{
  "schemaVersion": "evse.component-candidate/v1",
  "recordId": "example.contactor.dc100",
  "deviceClass": {
    "kind": "DeviceClass",
    "confidence": 0.99,
    "evidence": [{ "page": 1, "bbox": { "x": 0, "y": 1, "width": 40, "height": 1, "unit": "TEXT_LINES" }, "quote": "Example contactor terminal data" }],
    "id": { "value": "DC_CONTACTOR", "confidence": 0.99, "evidence": [{ "page": 1, "bbox": { "x": 0, "y": 1, "width": 40, "height": 1, "unit": "TEXT_LINES" }, "quote": "Example contactor terminal data" }] },
    "name": { "value": "DC contactor", "confidence": 0.99, "evidence": [{ "page": 1, "bbox": { "x": 0, "y": 1, "width": 40, "height": 1, "unit": "TEXT_LINES" }, "quote": "Example contactor terminal data" }] },
    "description": { "value": "Example normally-open DC contactor", "confidence": 0.99, "evidence": [{ "page": 1, "bbox": { "x": 0, "y": 1, "width": 40, "height": 1, "unit": "TEXT_LINES" }, "quote": "Example contactor terminal data" }] },
    "functionalPorts": [
      {
        "kind": "FunctionalPort",
        "confidence": 0.99,
        "evidence": [{ "page": 1, "bbox": { "x": 0, "y": 4, "width": 58, "height": 1, "unit": "TEXT_LINES" }, "quote": "Terminal X1/1 is the positive high-voltage input." }],
        "id": { "value": "DC_IN_POS", "confidence": 0.99, "evidence": [{ "page": 1, "bbox": { "x": 0, "y": 4, "width": 58, "height": 1, "unit": "TEXT_LINES" }, "quote": "Terminal X1/1 is the positive high-voltage input." }] },
        "name": { "value": "DC positive input", "confidence": 0.99, "evidence": [{ "page": 1, "bbox": { "x": 0, "y": 4, "width": 58, "height": 1, "unit": "TEXT_LINES" }, "quote": "Terminal X1/1 is the positive high-voltage input." }] },
        "direction": { "value": "INPUT", "confidence": 0.99, "evidence": [{ "page": 1, "bbox": { "x": 0, "y": 4, "width": 58, "height": 1, "unit": "TEXT_LINES" }, "quote": "Terminal X1/1 is the positive high-voltage input." }] },
        "electricalDomain": { "value": "HV_DC_POS", "confidence": 0.99, "evidence": [{ "page": 1, "bbox": { "x": 0, "y": 4, "width": 58, "height": 1, "unit": "TEXT_LINES" }, "quote": "Terminal X1/1 is the positive high-voltage input." }] },
        "purpose": { "value": "Positive high-voltage input", "confidence": 0.99, "evidence": [{ "page": 1, "bbox": { "x": 0, "y": 4, "width": 58, "height": 1, "unit": "TEXT_LINES" }, "quote": "Terminal X1/1 is the positive high-voltage input." }] },
        "physicalTerminalRefs": [
          { "value": "X1/1", "confidence": 0.99, "evidence": [{ "page": 1, "bbox": { "x": 0, "y": 4, "width": 58, "height": 1, "unit": "TEXT_LINES" }, "quote": "Terminal X1/1 is the positive high-voltage input." }] }
        ]
      }
    ]
  },
  "partVariant": {
    "kind": "PartVariant",
    "confidence": 0.99,
    "evidence": [{ "page": 1, "bbox": { "x": 0, "y": 1, "width": 40, "height": 4, "unit": "TEXT_LINES" }, "quote": "Example contactor terminal data" }],
    "id": { "value": "EXAMPLE_DC100_24V", "confidence": 0.99, "evidence": [{ "page": 1, "bbox": { "x": 0, "y": 3, "width": 20, "height": 1, "unit": "TEXT_LINES" }, "quote": "Model: DC100-24V" }] },
    "manufacturer": { "value": "EXAMPLE", "confidence": 0.99, "evidence": [{ "page": 1, "bbox": { "x": 0, "y": 1, "width": 40, "height": 1, "unit": "TEXT_LINES" }, "quote": "Example contactor terminal data" }] },
    "model": { "value": "DC100-24V", "confidence": 0.99, "evidence": [{ "page": 1, "bbox": { "x": 0, "y": 3, "width": 20, "height": 1, "unit": "TEXT_LINES" }, "quote": "Model: DC100-24V" }] },
    "deviceClassRef": { "value": "DC_CONTACTOR", "confidence": 0.99, "evidence": [{ "page": 1, "bbox": { "x": 0, "y": 1, "width": 40, "height": 1, "unit": "TEXT_LINES" }, "quote": "Example contactor terminal data" }] },
    "documentRevision": { "value": "REV-A", "confidence": 0.99, "evidence": [{ "page": 1, "bbox": { "x": 0, "y": 2, "width": 25, "height": 1, "unit": "TEXT_LINES" }, "quote": "Document revision: REV-A" }] },
    "description": { "value": "Example DC contactor variant", "confidence": 0.99, "evidence": [{ "page": 1, "bbox": { "x": 0, "y": 1, "width": 40, "height": 1, "unit": "TEXT_LINES" }, "quote": "Example contactor terminal data" }] },
    "connectors": [
      {
        "kind": "Connector",
        "confidence": 0.99,
        "evidence": [{ "page": 1, "bbox": { "x": 0, "y": 4, "width": 58, "height": 1, "unit": "TEXT_LINES" }, "quote": "Terminal X1/1 is the positive high-voltage input." }],
        "id": { "value": "X1", "confidence": 0.99, "evidence": [{ "page": 1, "bbox": { "x": 0, "y": 4, "width": 58, "height": 1, "unit": "TEXT_LINES" }, "quote": "Terminal X1/1 is the positive high-voltage input." }] },
        "name": { "value": "Power terminal", "confidence": 0.99, "evidence": [{ "page": 1, "bbox": { "x": 0, "y": 4, "width": 58, "height": 1, "unit": "TEXT_LINES" }, "quote": "Terminal X1/1 is the positive high-voltage input." }] },
        "type": { "value": "BOLTED_STUD", "confidence": 0.99, "evidence": [{ "page": 1, "bbox": { "x": 0, "y": 4, "width": 58, "height": 1, "unit": "TEXT_LINES" }, "quote": "Terminal X1/1 is the positive high-voltage input." }] },
        "terminals": [
          {
            "kind": "PhysicalTerminal",
            "confidence": 0.99,
            "evidence": [{ "page": 1, "bbox": { "x": 0, "y": 4, "width": 58, "height": 1, "unit": "TEXT_LINES" }, "quote": "Terminal X1/1 is the positive high-voltage input." }],
            "id": { "value": "1", "confidence": 0.99, "evidence": [{ "page": 1, "bbox": { "x": 0, "y": 4, "width": 58, "height": 1, "unit": "TEXT_LINES" }, "quote": "Terminal X1/1 is the positive high-voltage input." }] },
            "designation": { "value": "X1/1", "confidence": 0.99, "evidence": [{ "page": 1, "bbox": { "x": 0, "y": 4, "width": 58, "height": 1, "unit": "TEXT_LINES" }, "quote": "Terminal X1/1 is the positive high-voltage input." }] },
            "function": { "value": "DC_IN_POS", "confidence": 0.99, "evidence": [{ "page": 1, "bbox": { "x": 0, "y": 4, "width": 58, "height": 1, "unit": "TEXT_LINES" }, "quote": "Terminal X1/1 is the positive high-voltage input." }] },
            "electricalDomain": { "value": "HV_DC_POS", "confidence": 0.99, "evidence": [{ "page": 1, "bbox": { "x": 0, "y": 4, "width": 58, "height": 1, "unit": "TEXT_LINES" }, "quote": "Terminal X1/1 is the positive high-voltage input." }] },
            "direction": { "value": "INPUT", "confidence": 0.99, "evidence": [{ "page": 1, "bbox": { "x": 0, "y": 4, "width": 58, "height": 1, "unit": "TEXT_LINES" }, "quote": "Terminal X1/1 is the positive high-voltage input." }] },
            "functionalPortRefs": [
              { "value": "DC_IN_POS", "confidence": 0.99, "evidence": [{ "page": 1, "bbox": { "x": 0, "y": 4, "width": 58, "height": 1, "unit": "TEXT_LINES" }, "quote": "Terminal X1/1 is the positive high-voltage input." }] }
            ],
            "attributes": []
          }
        ]
      }
    ],
    "functionalUnits": [
      {
        "kind": "FunctionalUnit",
        "confidence": 0.99,
        "evidence": [{ "page": 1, "bbox": { "x": 0, "y": 1, "width": 40, "height": 4, "unit": "TEXT_LINES" }, "quote": "Example contactor terminal data" }],
        "id": { "value": "MAIN_CONTACT", "confidence": 0.99, "evidence": [{ "page": 1, "bbox": { "x": 0, "y": 1, "width": 40, "height": 1, "unit": "TEXT_LINES" }, "quote": "Example contactor terminal data" }] },
        "name": { "value": "Main contact", "confidence": 0.99, "evidence": [{ "page": 1, "bbox": { "x": 0, "y": 1, "width": 40, "height": 1, "unit": "TEXT_LINES" }, "quote": "Example contactor terminal data" }] },
        "type": { "value": "NORMALLY_OPEN_CONTACT", "confidence": 0.99, "evidence": [{ "page": 1, "bbox": { "x": 0, "y": 1, "width": 40, "height": 1, "unit": "TEXT_LINES" }, "quote": "Example contactor terminal data" }] },
        "connectorRefs": [
          { "value": "X1", "confidence": 0.99, "evidence": [{ "page": 1, "bbox": { "x": 0, "y": 4, "width": 58, "height": 1, "unit": "TEXT_LINES" }, "quote": "Terminal X1/1 is the positive high-voltage input." }] }
        ],
        "functionalPortRefs": [
          { "value": "DC_IN_POS", "confidence": 0.99, "evidence": [{ "page": 1, "bbox": { "x": 0, "y": 4, "width": 58, "height": 1, "unit": "TEXT_LINES" }, "quote": "Terminal X1/1 is the positive high-voltage input." }] }
        ],
        "attributes": [
          {
            "kind": "Attribute",
            "confidence": 0.99,
            "evidence": [{ "page": 1, "bbox": { "x": 0, "y": 5, "width": 32, "height": 1, "unit": "TEXT_LINES" }, "quote": "Coil nominal voltage: 24 VDC." }],
            "key": { "value": "coilNominalVoltage", "confidence": 0.99, "evidence": [{ "page": 1, "bbox": { "x": 0, "y": 5, "width": 32, "height": 1, "unit": "TEXT_LINES" }, "quote": "Coil nominal voltage: 24 VDC." }] },
            "value": { "value": 24, "confidence": 0.99, "evidence": [{ "page": 1, "bbox": { "x": 0, "y": 5, "width": 32, "height": 1, "unit": "TEXT_LINES" }, "quote": "Coil nominal voltage: 24 VDC." }] },
            "unit": { "value": "VDC", "confidence": 0.99, "evidence": [{ "page": 1, "bbox": { "x": 0, "y": 5, "width": 32, "height": 1, "unit": "TEXT_LINES" }, "quote": "Coil nominal voltage: 24 VDC." }] }
          }
        ]
      }
    ],
    "attributes": []
  }
}
